{
  "schemaVersion": "uis.head-preparation.candidate-asset/1",
  "kind": "candidate-asset",
  "id": "candidate-zero-padding-64-facing-left",
  "identity": {
    "characterId": "TEST_HeadPreparationCalibration-UncleA",
    "displayName": "Workbench Calibration Uncle A",
    "canonStatus": "non-canon"
  },
  "direction": "facing-left",
  "sourceAssetId": "source-facing-left",
  "preparationRunId": "run-zero-padding-64-facing-left",
  "artifact": {
    "path": "objects/sha256/e2/e21098a5cea4910a38e286dfeb4f6a905f8a3fd69acdc27621688ae6df9d3cdc",
    "mediaType": "image/png",
    "encodedSha256": "e21098a5cea4910a38e286dfeb4f6a905f8a3fd69acdc27621688ae6df9d3cdc",
    "pixelDataSha256": "ed7377adba2b47b5a42cc8931576880b0d60e531844b48e88950b42a14891a7c",
    "byteLength": 5897,
    "width": 64,
    "height": 64,
    "hasAlphaChannel": true,
    "hasTransparency": true
  },
  "initialState": "candidate",
  "createdAt": "2026-08-25T08:30:00.000Z"
}
