{
  "schemaVersion": "uis.head-preparation.candidate-asset/1",
  "kind": "candidate-asset",
  "id": "candidate-zero-padding-64-facing-right",
  "identity": {
    "characterId": "TEST_HeadPreparationCalibration-UncleA",
    "displayName": "Workbench Calibration Uncle A",
    "canonStatus": "non-canon"
  },
  "direction": "facing-right",
  "sourceAssetId": "source-facing-right",
  "preparationRunId": "run-zero-padding-64-facing-right",
  "artifact": {
    "path": "objects/sha256/a0/a025d2b5e540bc2ce9a0fdfe1458603a349589c26886dfbb117689958ed21229",
    "mediaType": "image/png",
    "encodedSha256": "a025d2b5e540bc2ce9a0fdfe1458603a349589c26886dfbb117689958ed21229",
    "pixelDataSha256": "6a67ee439c7bde0e63b0c362a3cb1d5757cb34b7ca9e5d951f01ed9703dabe49",
    "byteLength": 5863,
    "width": 64,
    "height": 64,
    "hasAlphaChannel": true,
    "hasTransparency": true
  },
  "initialState": "candidate",
  "createdAt": "2026-08-25T08:30:00.000Z"
}
